13019, "포항 제인풀빌라 펜션", "경북 포항시 북구 청하면 해안로 1884", 0
8884, "풍류헌한옥스테이", "전북 전주시 완산구 풍남문5길 21-7", 0
6982, "풍차와노을독채펜션", "제주 제주시 한경면 한경해안로 474-26", 0
11401, "프리마베라펜션", "경기 가평군 북면 가화로 2426-28", 0
11917, "프리미엄더원풀빌라", "경북 포항시 북구 송라면 해안로2626번길 18", 0
12757, "프리엔츠 풀스파펜션", "경북 영덕군 강구면 금진길 11", 0
9956, "프시케풀빌라(비대면체크인)", "충북 충주시 동량면 호반로 789-30", 0
7945, "플라토닉펜션", "경기 가평군 북면 가화로 1144-299", 0
11439, "플라트폼별장펜션", "강원 고성군 토성면 광포1길 68", 0
10176, "피카풀빌라", "경북 포항시 남구 장기면 영암길 45", 0
8470, "하늘과바다펜션", "충남 태안군 남면 한바위길 54-16", 0
5889, "하늘바다펜션", "충남 서산시 팔봉면 범머리길 114 팔봉면 범머리길 114", 0
9774, "하늘바다펜션", "충남 서산시 팔봉면 범머리길 114", 0
9657, "하루B", "경남 산청군 단성면 호암로632번길 78", 0
14534, "하루쉼", "경북 경주시 배반중리길 36-2", 0
10121, "하루펜션", "경북 포항시 북구 송라면 동해대로3378번길 54", 0
11535, "하루한옥펜션", "충북 단양군 가곡면 대대한옥길 31", 0
11876, "푸른향기펜션", "충남 보령시 웅천읍 간드리2길 49-100", 0
11609, "풀빌라467", "경북 경주시 보불로 126-142", 0
13861, "포항바다향펜션", "경북 포항시 남구 호미곶면 해맞이로46번길 2", 0
9883, "한국문화의집펜션", "경기 양평군 강하면 동문3길 68-1", 0
14508, "해안로2898", "경북 포항시 북구 송라면 해안로 2898", 0
5157, "해와달펜션", "경남 거제시 동부면 구천1길 41 동부면 구천1길 41", 0
11625, "향기마을펜션", "강원 횡성군 갑천면 갑천로 837", 0
9312, "허브하우스펜션", "경남 남해군 삼동면 예술길 63-3", 0
12710, "협재 클레르드륀", "제주 제주시 한림읍 협재2길 93-21", 0
13780, "홍천 브렌따노 풀빌라", "강원 홍천군 남면 남노일로 1076-38", 0
11950, "화이트큐브풀빌라", "경기 안산시 단원구 부흥로 287-62", 0
9730, "휴가온펜션", "경기 양평군 서종면 서차남1길 4-6", 0
8850, "희락정민박", "전남 나주시 노안면 노안삼도로 407-194", 0
13002, "힐스타펜션", "인천 옹진군 영흥면 영흥서로418번길 54", 0
11537, "SUN996펜션", "인천 강화군 길상면 해안남로620번길 48", 0
11459, "Y&J HOUSE", "충남 태안군 근흥면 낭금길 300-20", 0
12396, "가온들풀빌라", "경북 경주시 장매길 156", 0
6996, "가평 더풍경 독채풀빌라", "경기 가평군 상면 수목원로150번길 27-24", 0
14019, "가평 맘스테이 독채 풀빌라", "경기 가평군 상면 기와집길 174-41", 0
7055, "가평 모이스 독채 풀빌라 펜션", "경기 가평군 상면 수목원로 372", 0
4842, "가평 북면힐하우스", "경기 가평군 북면 백둔로560번길 36-1", 0
13871, "한옥펜션 신라마실", "경북 경주시 진티길 5-22", 0
10494, "해변민박(구. 숙이뜰펜션)", "충남 보령시 천북면 사호장은로 517-171", 0
5903, "가평 사랑방펜션", "경기 가평군 북면 꽃넘이길 87-15 북면 꽃넘이길 87-15", 0
12491, "가평독채풀빌라레인보우", "경기 가평군 가평읍 당목가일길 691-7", 0
10563, "가평청산별곡펜션", "경기 가평군 가평읍 태봉두밀로406번길 153-11", 0
11569, "감성펜션", "인천 강화군 길상면 초지로 562-26", 0
14209, "감포끼룩끼룩풀빌라펜션", "경북 경주시 감포읍 대밑길 26-1", 0
8750, "갑사자연속으로펜션", "충남 공주시 계룡면 되찬길 44", 0
13996, "강릉 House B", "강원 강릉시 강릉대로211번길 21-1", 0
14097, "강릉 House B", "강원 강릉시 강릉대로211번길 21-1", 0
14109, "강릉 Tommys", "강원 강릉시 경강로2069번길 14", 0
13979, "강릉 더강릉오션스테이 Class10", "강원 강릉시 사천면 진리항구2길 5", 0
13157, "가평 예쁜집", "경기 가평군 북면 논남기길403번길 17-31", 0
13158, "강릉 더강릉오션스테이 Class7", "강원 강릉시 사천면 진리항구2길 6", 0
13244, "강릉 더강릉오션스테이 Class9", "강원 강릉시 사천면 진리항구2길 5", 0
13952, "강릉 더강릉오션스테이 Class9", "강원 강릉시 사천면 진리항구2길 5", 0
13904, "강릉 더강릉오션스테이 Episode1", "강원 강릉시 사천면 진리항구2길 5", 0
14617, "강릉 더강릉오션스테이 Episode3", "강원 강릉시 사천면 진리항구2길 5", 0
14803, "강릉 더강릉오션스테이 Episode3", "강원 강릉시 사천면 진리항구2길 5", 0
7642, "가평 팡팡 독채펜션", "경기 가평군 북면 멱골로 398-14", 0
8277, "강릉 더강릉오션스테이 Class6", "강원 강릉시 사천면 진리항구2길 5", 0
13646, "가평 에코 독채풀빌라펜션", "경기 가평군 북면 보안벚꽃길 156", 0
14618, "강릉 더강릉오션스테이 Episode4", "강원 강릉시 사천면 진리항구2길 5", 0
13877, "강릉 더강릉오션스테이 season2", "강원 강릉시 사천면 진리항구2길 5", 0
14808, "강릉 더강릉오션스테이 Episode4", "강원 강릉시 사천면 진리항구2길 5", 0
14503, "강릉 더강릉오션스테이 season8", "강원 강릉시 사천면 진리항구2길 5", 0
14751, "강릉 드림펜션", "강원 강릉시 연곡면 진고개로 1424-45", 0
13105, "강릉 로그하우스 독채펜션", "강원 강릉시 유다리길37번길 14", 0
7983, "강릉 샘물스테이", "강원 강릉시 샘물터길2번길 16", 0
12801, "강릉 샘물스테이", "강원 강릉시 샘물터길2번길 16", 0
8271, "강릉 쉬어가는집", "강원 강릉시 연곡면 성안길 20-11", 0
13867, "강릉 쉬어가는집", "강원 강릉시 연곡면 성안길 20-11", 0
14250, "강릉 스테이오로지 독채 펜션", "강원 강릉시 사천면 중앙서로 92-104", 0
13944, "강릉 스테이즈므로", "강원 강릉시 과학단지로21번길 5-24", 0
13892, "강릉 스테이즈므로(23년 09월 신축,독채)", "강원 강릉시 과학단지로21번길 5-24", 0
13880, "강릉 더강릉오션스테이 season3", "강원 강릉시 사천면 진리항구2길 5", 0
5632, "강릉사천바다독채펜션", "강원 강릉시 사천면 중앙동로 234 사천면 중앙동로 234", 0
12521, "강릉애진심펜션", "강원 강릉시 칠봉로 720", 0
13041, "강릉휴가스테이", "강원 강릉시 안현로 167-57", 0
11866, "강화 계절의향기펜션", "인천 강화군 내가면 고비고개로741번길 42-12", 0
14502, "강릉 더강릉오션스테이 season6", "강원 강릉시 사천면 진리항구2길 5", 0
14703, "강릉비밀의정원 풀빌라", "강원 강릉시 사천면 방동안길 194", 0
6743, "강화 아우라 독채펜션", "인천 강화군 화도면 해안남로 2166-32", 0
6006, "강화하늘채펜션", "인천 강화군 화도면 해안남로 2272-25 화도면 해안남로 2272-25", 0
12115, "강화호반펜션", "인천 강화군 양도면 중앙로 825", 0
11788, "개나리펜션", "전북 완주군 동상면 대아수목로 144-33", 0
9071, "개울가펜션", "경기 양평군 서종면 황순원로 101", 0
10540, "거제 sw풀빌라펜션", "경남 거제시 장목면 두모실길 121-34", 0
8212, "거제 사곡오션뷰독채 펜션", "경남 거제시 사등면 모래실1길 37-6", 0
10513, "거제 프렌즈하우스풀빌라펜션", "경남 거제시 장목면 두모실길 121-30", 0
13436, "경주 JNG풀빌라", "경북 경주시 외동읍 죽동길 160-60", 0
11903, "경주 더휴풀빌라", "경북 경주시 감포읍 오류길 63-5", 0
13778, "경주 더휴풀빌라", "경북 경주시 감포읍 오류길 63-5", 0
14824, "경주 디올풀빌라 독채", "경북 경주시 천북면 물천안길 174-35", 0
13503, "경주 루나풀빌라 독채", "경북 경주시 장매길 154", 0
5966, "강화 황청덕산 펜션", "인천 강화군 내가면 황청포구로385번길 55-132 내가면 황청포구로385번길 55-132", 0
8128, "경주 스테이북군", "경북 경주시 북군1길 9", 0
12920, "경주 스테이북군", "경북 경주시 북군1길 9", 0
14691, "경주 스튜디오 오소", "경북 경주시 외동읍 신기앞길 114-53", 0
14219, "경주 미소펜션", "경북 경주시 하동못안길 67", 0
6323, "강화 제임스펜션", "인천 강화군 내가면 강화서로227번길 51 내가면 강화서로227번길 51", 0
13421, "경주 메모아르 기억장치2", "경북 경주시 외동읍 죽동길 160-56", 0
8967, "경주 어디에서왔니 펜션", "경북 경주시 광산길 199-11", 0
5834, "경주 초이스 키즈펜션(독채형)", "경북 경주시 천북면 목실길 14-23 천북면 목실길 14-23", 0
13432, "경주 위드베베 독채키즈가족풀빌라", "경북 경주시 새골길 49-115", 0
14720, "경주 푸르미르독채풀빌라", "경북 경주시 천북면 물천안길 27-44", 0
14414, "경주 희다풀빌라", "경북 경주시 서낭길 122-30", 0
13528, "경주 포시즌풀빌라", "경북 경주시 외동읍 영불로 28-123", 0
13531, "경주단체감성풀빌라", "경북 경주시 문무대왕면 능골연당길 55-4", 0
13886, "경주단체감성풀빌라", "경북 경주시 문무대왕면 능골연당길 55-4", 0
13122, "경주베리키즈풀빌라", "경북 경주시 감포읍 경감로 2641", 0
8256, "고성 들꽃스테이 독채", "강원 고성군 토성면 용촌길 3-20", 0
7780, "고성 루체루나펜션", "강원 고성군 토성면 사진용촌길 107-5", 0
12619, "고성 루체루나펜션", "강원 고성군 토성면 사진용촌길 107-5", 0
8176, "고성 코리아 inn 독채펜션", "강원 고성군 토성면 신평1길 28-9", 0
14514, "고성 파노라마오션뷰 풀빌라", "강원 고성군 죽왕면 교암2길 65", 0
13012, "경주감포비치뷰", "경북 경주시 감포읍 동해안로 2489", 0
6048, "고전한옥펜션", "강원 강릉시 난곡길 7-8 난곡길 7-8", 0
8111, "고흥 남순재 한옥 스테이", "전남 고흥군 점암면 장남2길 19", 0
6523, "광주 포시즌 키즈펜션", "경기 광주시 퇴촌면 원당길 119-4", 0
12955, "고성 휘계스테이", "강원 고성군 토성면 진등길 316", 0
13247, "구룡포 장길리민박", "경북 포항시 남구 구룡포읍 동해안로4363번길 3-16", 0
14773, "귀덕 1084", "제주 제주시 한림읍 귀덕12길 12", 0
5585, "금옥독채통나무펜션", "제주 서귀포시 남원읍 중산간동로7141번길 2 남원읍 중산간동로7141번길 2", 0
7932, "길따라행운펜션", "경기 가평군 북면 가화로 1364-76", 0
12497, "김녕별장", "제주 제주시 구좌읍 김녕로11길 5-5", 0
11605, "까멜리아펜션", "경기 안산시 단원구 소득길 51", 0
14810, "꾸꾸풀빌라", "경북 경주시 보덕로 143-19", 0
10990, "나래펜션", "경기 안산시 단원구 중부흥2길 40", 0
13416, "나주 고택 산에는꽃이피네", "전남 나주시 다도면 동력길 20-1", 0
13506, "나주 도란도란하우스 한옥", "전남 나주시 다도면 풍산내촌길 3-10", 0
14007, "나해풀빌라", "경기 안산시 단원구 부흥로 287-116", 0
8532, "남산한옥관", "경북 경주시 내남면 포석로 435-9", 0
13366, "남해 라에스뜨레야 칠성장", "경남 남해군 서면 남서대로 1949-3", 0
14616, "남해 스테이단 풀빌라", "경남 남해군 서면 남서대로 1987", 0
8009, "남해 촌캉스 펜션", "경남 남해군 삼동면 동부대로1122번길 47-6", 0
12864, "남해바다소리펜션", "경남 남해군 창선면 흥선로 1809-37", 0
13048, "노브힐스테이", "제주 제주시 아연로 124-32", 0
12856, "노스토스", "경기 가평군 북면 오목골길 39-106", 0
14149, "노을스파펜션", "인천 옹진군 영흥면 영흥남로9번길 446", 0
11911, "글로리 키즈풀빌라", "경북 포항시 북구 흥해읍 해안로1732번길 6", 0
14110, "그린존리조트", "인천 강화군 송해면 오류내길99번길 40-3", 0
11291, "놀마루29", "경기 양평군 양서면 제탄2길 29", 0
7814, "단양 위풍당당", "충북 단양군 영춘면 영부로 1293-7", 0
14117, "단양 하늘마루 독채 펜션", "충북 단양군 영춘면 영부로 1293-1", 0
9487, "달빛이머무는집펜션", "경기 양평군 강상면 세월길147번길 201", 0
12927, "달빛천사풀빌라", "강원 강릉시 연곡면 진고개로 1424-21", 0
14466, "다온키즈펜션", "경기 안산시 단원구 멍골2길 15-1", 0
8638, "담쟁이펜션", "제주 제주시 구좌읍 구좌로 26-3", 0
11564, "당근바다펜션", "인천 강화군 내가면 황청포구로462번길 4-37", 0
12899, "당림여관", "강원 춘천시 서면 샛말길 290", 0
13161, "당진 스테이199", "충남 당진시 구봉로 199", 0
13530, "대부도 그곳에가면 키즈 풀빌라", "경기 안산시 단원구 수영목길 27-51", 0
13539, "대부도 까멜리아 풀빌라", "경기 안산시 단원구 소득길 51", 0
8727, "대부도 누리마루펜션", "경기 안산시 단원구 진두길 41", 0
14614, "대부도 더스케치 펜션", "경기 안산시 단원구 참살이번영길 3-1", 0
9277, "대부도 메송프로방스 펜션", "경기 안산시 단원구 참살이번영길 10", 0
13538, "대부도 보니따 풀빌라", "경기 안산시 단원구 부흥로 277-1", 0
14649, "대부도 세비야 풀빌라", "경기 안산시 단원구 참살이번영길 6", 0
12336, "달빛향한옥독채펜션", "전북 전주시 완산구 전주천동로 64-16", 0
14099, "다올스테이", "제주 제주시 애월읍 광상로 303", 0
14039, "다윌조이너스", "경기 안산시 단원구 돈지섬길 148", 0
11845, "대부도 아젤리아펜션", "경기 안산시 단원구 대호5길 37", 0
8300, "대부도 쥬디스 풀빌라", "경기 안산시 단원구 부흥로 277", 0
14681, "대부도 콘서트375", "경기 안산시 단원구 나루개길 10-11", 0
5811, "대부도 폴라리스펜션", "경기 안산시 단원구 참살이1길 4 단원구 참살이1길 4", 0
7101, "대부도 주니 독채풀빌라펜션", "경기 안산시 단원구 수영목길 29-26", 0
12234, "대부도원", "경기 안산시 단원구 중부흥2길 41", 0
14705, "대부정", "경기 안산시 단원구 강거래9길 8", 0
11035, "대성정담한옥", "전북 전주시 완산구 고덕산1길 30", 0
14495, "대흘에서", "제주 제주시 조천읍 대흘5길 88-17", 0
14485, "더블레싱23", "경기 안산시 단원구 멍골2길 23", 0
10841, "대부도 해바라기펜션", "경기 안산시 단원구 장불길 30", 0
12857, "더스테이", "경기 안산시 단원구 부흥로 287-290", 0
12958, "더아이랑 키즈풀빌라", "경기 남양주시 수동면 지둔로307번길 62-12", 0
12956, "더온리풀빌라", "강원 고성군 토성면 무릉도원로 946", 0
14006, "더지냄풀빌라", "경북 경주시 보불로 190-7", 0
5244, "더포레펜션", "경기 가평군 청평면 상지로 280 청평면 상지로 280", 0
6040, "덕산 솔향기펜션", "충남 예산군 덕산면 대치남길 25 덕산면 대치남길 25", 0
13922, "대부도 이응이응 독채풀빌라", "경기 안산시 단원구 참살이4길 15", 0
13917, "대부도 와펜션", "경기 안산시 단원구 돈지섬길 148-3", 0
11641, "더스카이풀빌라", "경기 안산시 단원구 부흥로 225-17", 0
12017, "데미샘1937한옥숙박펜션", "전북 전주시 완산구 한지길 100-7", 0
9638, "데일리펜션", "제주 서귀포시 성산읍 온평애향로 67-1", 0
14597, "델켓풀빌라", "경기 안산시 단원구 강거래길 11", 0
9246, "도령펜션", "인천 강화군 길상면 신촌로146번길 14-10", 0
13997, "돈내코독채온수풀빌라", "제주 서귀포시 돈내코로67번길 34", 0
7625, "동해 비치한섬", "강원 동해시 한섬로 136", 0
14553, "동해애펜션", "강원 동해시 구미2길 3-2", 0
14480, "디하우스", "강원 강릉시 성산면 삼왕길 167", 0
13032, "또옴풀빌라", "제주 제주시 해안마을13길 30-37", 0
8834, "똘랑코티지 한옥독채펜션", "전북 전주시 완산구 서학로 63-17", 0
12522, "동해 비치한섬", "강원 동해시 한섬로 136", 0
14144, "라라스테이풀빌라", "경기 안산시 단원구 멍골1길 5", 0
14037, "라비즈/애견(숯무료)", "경기 안산시 단원구 소득길 97-23", 0
11519, "라온펜션", "인천 강화군 화도면 해안남로 2166-64", 0
12797, "라이엔네 풀빌라 스테이", "제주 제주시 한경면 주전길 92-9", 0
9427, "라임힐펜션", "강원 강릉시 한밭골길 50-26", 0
8629, "들꽃향기머무는곳 독채펜션", "경기 양평군 용문면 용문삼성로20번길 73-22", 0
14041, "룰루랄라AB", "경기 안산시 단원구 부흥로 241-65", 0
8769, "로젤147펜션", "강원 고성군 토성면 용암길 120-3", 0
12407, "루나풀빌라", "경북 경주시 장매길 154", 0
14603, "리버팜풀빌라", "강원 춘천시 남산면 북한강변길 46-5", 0
14621, "마을안길", "강원 강릉시 난설헌로193번길 32-3", 0
12441, "마음가", "강원 춘천시 신동면 솟발길 65", 0
6723, "마이호텔 양평 드라마타운", "경기 양평군 용문면 연수로 414-12 용문면 연수로 414-12", 0
8916, "맑은숲펜션", "경기 양평군 단월면 통골길 28-11", 0
14284, "맘스테이", "경기 가평군 상면 기와집길 174-8", 0
11678, "매드몽키플레이스", "경기 가평군 설악면 자잠로 192", 0
14735, "마메든펜션", "경기 안산시 단원구 구봉솔밭1길 6", 0
9884, "명화펜션", "인천 옹진군 영흥면 선재로197번길 91", 0
14531, "모리에펜션", "인천 강화군 불은면 해안동로 331-19", 0
14780, "물천리1044", "경북 경주시 천북면 목실길 36-3", 0
14562, "미가쉴독채펜션", "경기 가평군 가평읍 북한강변로 1007-42", 0
9330, "미담펜션", "강원 원주시 판부면 백운정윗길 14-16", 0
12483, "미르펜션", "경기 안산시 단원구 중부흥2길 42-7", 0
5501, "미소가펜션", "제주 서귀포시 남원읍 태위로44번길 2-1 남원읍 태위로44번길 2-1", 0
10934, "바다가그리운나무펜션", "인천 강화군 내가면 해안서로 1024-1", 0
14673, "머물구자", "강원 강릉시 금성로11번길 13-7", 0
11160, "바다정원펜션", "인천 옹진군 영흥면 선재로170번안길 42-22", 0
11617, "마레아풀빌라", "경북 경주시 광산안길 70", 0
14567, "리틀포레스트 2호점", "경남 거제시 덕포2길 47-2", 0
11710, "바다정원펜션", "경기 안산시 단원구 대호5길 33", 0
10322, "배내골 산골이야기펜션", "경남 양산시 원동면 배내로 73", 0
10782, "벽전도예가펜션", "인천 강화군 길상면 강화동로74번길 50-89", 0
6564, "별빛독채펜션", "강원 정선군 남면 자뭇골길 172 남면 자뭇골길 172", 0
9796, "별빛언덕펜션", "경기 가평군 청평면 수리재길 428", 0
12614, "보리네뜰펜션", "경북 경주시 마동탑마을길 23-1", 0
8198, "보리독채펜션", "제주 제주시 백포북길 6-2", 0
12933, "보리독채펜션", "제주 제주시 백포북길 6-2", 0
13061, "봄날에햇살", "제주 제주시 애월읍 봉성로 24", 0
14168, "부산 보다스테이 1호점", "부산 수영구 민락수변로 125", 0
8558, "부산 씨앤요트", "부산 해운대구 해운대해변로 52", 0
14269, "바우하우스인 원주", "강원 원주시 흥업면 분지동1길 49", 0
7801, "부안 구름호수마을 바다가보이는집", "전북 부안군 진서면 청자로 473-3", 0
14289, "북토리스테이", "경북 경주시 외동읍 제내못안길 25-152", 0
12401, "불국사한옥스테이정원", "경북 경주시 마동탑마을길 51", 0
11711, "블루아리아", "경기 안산시 단원구 대호5길 35", 0
14638, "바닷가 로뎀나무 펜션", "전북 부안군 진서면 작당길 19", 0
5589, "비자림미담", "제주 제주시 구좌읍 비자숲길 13 구좌읍 비자숲길 13", 0
8906, "블루오션펜션", "충남 보령시 천북면 나룻개길 80", 0
6294, "부산 요트킹 스테이", "부산 해운대구 해운대해변로 30 해운대해변로 30", 0
13031, "비치다풀빌라", "경기 안산시 단원구 느릿부리안길 40-1", 0
11693, "빌라엘라 풀빌라&독채 펜션", "경기 양평군 옥천면 돗내미길 63", 0
11782, "산내황금펜션", "경북 경주시 산내면 문복로 850-13", 0
9486, "산들애펜션", "경남 통영시 산양읍 세포큰길 120-24", 0
10907, "산마루독채펜션", "강원 고성군 토성면 사진용촌1길 20", 0
5229, "산모퉁이펜션", "경기 양평군 용문면 용문삼성로 241 용문면 용문삼성로 241", 0
7924, "산방산오션브릭독채풀빌라", "제주 서귀포시 안덕면 산방로 75-3", 0
9931, "산수골펜션", "경기 양평군 강하면 전의2길 69-17", 0
6486, "삼악산펜션", "강원 춘천시 서면 덕두원길 118-16 서면 덕두원길 118-16", 0
12728, "삼촌네독채펜션", "인천 강화군 내가면 황청포구로443번길 90-5", 0
14541, "산내방학", "경북 경주시 산내면 오봉로 739-33", 0
6823, "서귀포 하논의아침 독채펜션", "제주 서귀포시 일주동로 8919-1", 0
13902, "서산해양정원펜션", "충남 서산시 팔봉면 호리중말길 75", 0
9696, "서휴재", "경북 경주시 강동면 부조중명길 362-43", 0
9776, "석모로펜션", "", 0
13085, "선암스테이", "전북 김제시 금구면 선암3길 36-85", 0
6165, "선양빌리지돔카라반", "제주 제주시 조천읍 와흘로 350 조천읍 와흘로 350", 0
5591, "샤인빌", "제주 서귀포시 표선면 가시로 340 표선면 가시로 340", 0
11540, "산들독채펜션", "강원 횡성군 둔내면 강변로 620-21", 0
14060, "빨강놀이터펜션", "경기 안산시 단원구 부흥로 293", 0
12233, "선재도 아지트풀빌라", "인천 옹진군 영흥면 선재로 76-19", 0
12831, "소돌스테이풀빌라", "강원 강릉시 주문진읍 해안로 1909", 0
6013, "소리하우스", "충남 태안군 안면읍 안면대로 2608-203 안면읍 안면대로 2608-203", 0
14659, "소산당", "전남 구례군 토지면 운조루길 35-17", 0
13163, "소서제주 7월3일", "제주 제주시 애월읍 유수암동3길 31-2", 0
14630, "소소153펜션", "강원 횡성군 우천면 내용둔서길 146", 0
7187, "속초 리안비채 1023호", "강원 속초시 영랑해안8길 11", 0
12402, "속초 리안비채 1023호", "강원 속초시 영랑해안8길 11", 0
7188, "속초 리안비채 1819호", "강원 속초시 영랑해안8길 11", 0
12400, "속초 리안비채 1819호", "강원 속초시 영랑해안8길 11", 0
7260, "속초 비로소 가을", "강원 속초시 장성천길 61-27", 0
7033, "속초 비로소 봄", "강원 속초시 장성천길 61-33", 0
8338, "세월산장펜션", "경기 양평군 강상면 다래길114번길 3", 0
13107, "속초 비로소 하늘", "강원 속초시 장성천길 61-35", 0
7110, "속초 써밋베이 1220호", "강원 속초시 영랑해안8길 11", 0
7253, "속초 써밋베이 1222호", "강원 속초시 영랑해안8길 11", 0
12448, "속초 써밋베이 1222호", "강원 속초시 영랑해안8길 11", 0
11961, "속초 비로소 봄", "강원 속초시 장성천길 61-27", 0
14178, "소길채", "경남 양산시 원동면 감토봉길 12", 0
11277, "소나무힐링펜션", "충남 서산시 성연면 생동사동길 192-38", 0
7109, "속초 써밋베이 1301호", "강원 속초시 영랑해안8길 11", 0
7609, "속초 써밋베이 1701호", "강원 속초시 영랑해안8길 11", 0
12475, "속초 써밋베이 1620호", "강원 속초시 영랑해안8길 11", 0
13132, "속초 써밋베이 1909호", "강원 속초시 영랑해안8길 11", 0
7252, "속초 써밋베이 2022호", "강원 속초시 영랑해안8길 11", 0
12451, "속초 써밋베이 2022호", "강원 속초시 영랑해안8길 11", 0
7210, "속초 써밋베이 스테이", "강원 속초시 영랑해안8길 11", 0
7108, "속초 써밋베이 1909호", "강원 속초시 영랑해안8길 11", 0
14585, "속초 써밋베이 1703호", "강원 속초시 영랑해안8길 11", 0
7757, "속초 써밋베이 오션뷰 1705", "강원 속초시 영랑해안8길 11", 0
12603, "속초 써밋베이 오션뷰 1705", "강원 속초시 영랑해안8길 11", 0
7869, "속초 써밋베이 오션뷰 609", "강원 속초시 영랑해안8길 11", 0
12694, "속초 써밋베이 오션뷰 609", "강원 속초시 영랑해안8길 11", 0
12594, "속초 써밋베이 오션뷰 707", "강원 속초시 영랑해안8길 11", 0
7251, "속초 써밋베이 퀸오션뷰", "강원 속초시 영랑해안8길 11", 0
12447, "속초 써밋베이 퀸오션뷰", "강원 속초시 영랑해안8길 11", 0
7685, "속초 써밋베이 태화", "강원 속초시 영랑해안8길 11", 0
12565, "속초 써밋베이 태화", "강원 속초시 영랑해안8길 11", 0
12425, "속초 써밋베이 스테이", "강원 속초시 영랑해안8길 11", 0
7111, "속초 써밋베이 오션뷰 1208", "강원 속초시 영랑해안8길 11", 0
7320, "속초 써밋베이 파노라마오션뷰", "강원 속초시 영랑해안8길 11", 0
7743, "속초 써밋베이 파노라마오션뷰 7", "강원 속초시 영랑해안8길 11", 0
12586, "속초 써밋베이 파노라마오션뷰 7", "강원 속초시 영랑해안8길 11", 0
7744, "속초 써밋베이 파노라마오션뷰 8", "강원 속초시 영랑해안8길 11", 0
12587, "속초 써밋베이 파노라마오션뷰 8", "강원 속초시 영랑해안8길 11", 0
12631, "속초 써밋베이 파노라마오션뷰 14", "강원 속초시 영랑해안8길 11", 0
