10375, "아이리스펜션", "경기 화성시 서신면 해안길178번길 41", 0
5931, "양양 물내음솔내음 애견동반 펜션", "강원 양양군 강현면 화채봉길 183", 0
9618, "별빛하늘펜션", "경남 거제시 장목면 신촌길 13-12", 0
14067, "서산 뷰라이브", "충남 서산시 지곡면 왕산길 16-49", 0
8978, "양각산펜션", "충남 금산군 부리면 양각산길 69", 0
6634, "양평 산타 펜션", "경기 양평군 서종면 서정로 67-41", 0
10815, "에꼬빌펜션", "전북 무주군 설천면 구천동로 954-7", 0
10104, "연리지펜션", "전남 담양군 용면 가마골로 4-18", 0
6589, "영흥도 두니아 스파 펜션", "인천 옹진군 영흥면 영흥로251번길 25-35", 0
7390, "오하브글램핑펜션_애견동반가능", "경기 가평군 북면 꽃넘이길 43", 0
6263, "용추계곡여행펜션", "경기 가평군 가평읍 용추로 508-10 가평읍 용추로 508-10", 0
7398, "원주 산사랑글램핑", "강원 원주시 소초면 구룡사로 127-1", 0
14054, "이따가다풀빌라", "경북 청도군 풍각면 봉수길 683", 0
12113, "자니펜션_애견동반가능(300평운동장*대형견*불멍)", "경기 가평군 북면 백둔로133번길 12-12", 0
7030, "여수 하이맘 키즈 가족 펜션 블랙", "전남 여수시 돌산읍 평사로 491", 0
4818, "전주 덕인당앤수하우스 펜션", "전북 전주시 완산구 풍남문3길 28-3 완산구 풍남문3길 28-3", 0
13858, "전주 소담고택 독채", "전북 전주시 완산구 최명희길 10", 0
5018, "전주 앤 게스트하우스", "전북 전주시 완산구 서학3길 83 완산구 서학3길 83", 0
13259, "전주 정담 전통한옥펜션", "전북 전주시 완산구 최명희길 21-4", 0
7722, "전주 행복헌 한옥 독채펜션", "전북 전주시 완산구 은행로 83-20", 0
14217, "전주한옥 새하마노 펜션", "전북 전주시 완산구 태조로 26-14", 0
4883, "제부도 애니멀카페&펜션", "경기 화성시 서신면 해안길178번길 12 서신면 해안길178번길 12", 0
7317, "전주 감성한옥 하루 독채펜션", "전북 전주시 완산구 태조로 12-16", 0
13712, "어썸칸펜션", "충남 태안군 원북면 신두해변길 131", 0
6517, "여수 복자 스파 펜션", "전남 여수시 돌산읍 평사로 331", 0
13524, "제주 미아독채풀빌라 (야외대형미온수 수영장 보유!)", "제주 제주시 애월읍 유수암북길 98", 0
10537, "지리산뱀사골리움펜션", "전북 남원시 산내면 지리산로 829", 0
10863, "청솔콘도형민박", "충남 태안군 남면 용궁길 106", 0
7290, "청주 천경대키즈풀빌라", "충북 청주시 상당구 미원면 옥화길 22-30", 0
12545, "초성애니멀와", "경기 연천군 청산면 평화로 209", 0
13187, "춘천 별꽃숲", "강원 춘천시 서면 샛말길 292", 0
14600, "클랭블루 수동", "제주 제주시 한경면 수동1길 3", 0
6620, "태안 맘모스 펜션", "충남 태안군 근흥면 연포1길 4", 0
13160, "태안 스테이 더 딜라잇 프라이빗", "충남 태안군 원북면 신두해변길 103", 0
14293, "제주 스테이온", "제주 제주시 애월읍 신상로 399", 0
11553, "토마토펜션", "강원 홍천군 남면 남노일로 1157-2", 0
10099, "판도라의상자", "경북 성주군 수륜면 백운2길 40-29", 0
10368, "편백숲이야기펜션", "전북 완주군 상관면 죽림편백길 53", 0
11959, "풍안펜션", "경남 산청군 삼장면 친환경로372번길 47", 0
5452, "핀란드펜션", "경기 안산시 단원구 큰망생이1길 13 단원구 큰망생이1길 11", 0
10754, "핑키마린펜션", "경남 남해군 삼동면 동부대로942번길 6", 0
8756, "하늘정원 빌리지", "전북 남원시 산내면 산내달궁길 16-10", 0
14497, "하도리 님과 함께", "제주 제주시 구좌읍 하도1길 25-2", 0
8225, "태안 연포해변앞 펜션", "충남 태안군 근흥면 연포2길 70-11", 0
13148, "종로 준오 호텔", "서울 종로구 인사동16길 6", 0
10849, "한울한옥스테이", "경기 용인시 처인구 양지면 송주로236번길 110", 0
9292, "해피트리펜션", "충남 태안군 안면읍 삼봉길 198-3", 0
10237, "해미레리조트형펜션", "강원 인제군 기린면 조침령로 1178", 0
5915, "홍천 밸리뷰펜션", "강원 홍천군 서면 한서로 1988 서면 한서로 1988", 0
5010, "홍천 알투스펜션", "강원 홍천군 서면 한치골길 751-30 서면 한치골길 751-30", 0
11999, "압구정펜션", "경기 가평군 상면 수목원로 120", 0
7085, "가평 너를그리다펜션", "경기 가평군 북면 백둔로467번길 65-35", 0
10572, "삼척 따봉펜션", "강원 삼척시 근덕면 삼척로 2056", 0
13597, "르벙 쓸레브", "제주 제주시 한경면 청수서5길 1-13 (청수리)", 0
6864, "강릉 발리까미펜션 B(까미동)", "강원 강릉시 경포로371번길 27-6", 0
6863, "인제 라이프위드도그 리조트", "강원 인제군 인제읍 자작나무숲길 1112", 0
10549, "노을빛진산펜션", "충남 태안군 남면 진산2길 186", 0
14683, "여수 캐슬디아트", "전남 여수시 웅천남1로 66", 0
14025, "가평 도그랜드글램핑", "경기 가평군 조종면 운악청계로 238-68", 0
13787, "완도보길도해돋이", "전남 완도군 보길면 예송로 258", 0
5391, "전주한옥마을 성심해오름", "전북 전주시 완산구 경기전길 126 완산구 경기전길 126", 0
14578, "부산 젬스테이", "부산 부산진구 중앙대로 752", 0
8861, "해바라기펜션", "경남 밀양시 단장면 도래재로 257-36", 0
9134, "강촌언덕민박", "강원 춘천시 남산면 강촌구곡길 29", 0
3922, "강촌 초코민트펜션", "강원 춘천시 남산면 풀무골1길 58 (방곡리)", 0
7657, "제주 송당송당펜션앤리조트", "제주 제주시 구좌읍 비자림로 1220", 0
4950, "전주 낭만시대 게스트하우스", "전북 전주시 완산구 동문길 102 완산구 동문길 102", 0
6316, "대천 하하펜션", "충남 보령시 고잠1길 67 고잠1길 67", 0
13245, "광주 호텔 더힐", "광주 남구 독립로 9-10", 0
14389, "경주 인히어 게스트하우스", "경북 경주시 동문로24번길 4", 0
7804, "양양 스테이다로 STAYDARO", "강원 양양군 현북면 하조대2길 11", 0
14474, "넘버25 호텔 동암역점", "인천 부평구 열우물로 42-16", 0
8133, "보령 바로빌리지", "충남 보령시 웅천읍 갓골1길 12-12", 0
13232, "부산 송리단펜션", "부산 해운대구 송정강변로 19", 0
14380, "경주 게스트하우스 소풍", "경북 경주시 원효로 260", 0
8016, "양산 더힐링호텔", "경남 양산시 물금읍 범어3길 22", 0
7254, "고성 거진호텔", "강원 고성군 거진읍 거탄진로 15", 0
13567, "광명 쉘부르 호텔", "경기 광명시 범안로 990", 0
8032, "여수 다올장 게스트하우스", "전남 여수시 봉산남4길 23-10", 0
5426, "영흥도b급하우스 채하", "인천 옹진군 영흥면 영흥남로9번길 141 영흥면 영흥남로9번길 141", 0
6975, "제주 아모르하우스 펜션", "제주 제주시 구좌읍 해맞이해안로 2060-18", 0
13147, "서귀포 제주브리즈 풀빌라", "제주 서귀포시 표선면 세성로 67-30", 0
5413, "서귀포 더쉼팡풀빌라", "제주 서귀포시 표선면 세성로 67-10 표선면 세성로 67-10", 0
8250, "제주여성전용게스트하우스 한나스테이", "제주 제주시 광양1길 6", 0
6143, "협재쉬멍놀멍 게스트하우스&펜션(신축)", "제주 제주시 한림읍 협재2길 30 한림읍 협재2길 30", 0
14573, "광주 호텔 더시티", "광주 광산구 임방울대로825번길 21-42", 0
6084, "양양 패밀리펜션", "강원 양양군 손양면 선사유적로 501-26 손양면 선사유적로 501-26", 0
5377, "여수 포유호스텔", "전남 여수시 오동도로 46 오동도로 46", 0
6419, "신축 오션뷰 / 강릉 B612 스파펜션 /  넷플릭스", "강원 강릉시 사천면 해안로 1149 사천면 해안로 1149", 0
6418, "신축 오션뷰 / 강릉 어린왕자 스파펜션 /  개별스파(전용입욕제제공)", "강원 강릉시 사천면 해안로 1149 사천면 해안로 1149", 0
5911, "신축 오션뷰 / 강릉 음악시간 스파펜션 / 개별스파(전용입욕제제공)", "강원 강릉시 사천면 해안로 1151 사천면 해안로 1151", 0
5289, "전주한옥마을 이가한옥", "전북 전주시 완산구 간납로 8 완산구 간납로 8", 0
7309, "제주펜션 바다너머집", "제주 서귀포시 성산읍 일주동로 5177-20", 0
5343, "평창 현대스위트빌리지 펜션", "강원 평창군 봉평면 진조1길 43-8 봉평면 진조1길 43-8", 0
6050, "가평 눈깔사탕펜션", "경기 가평군 북면 제령아랫말길 67-26 북면 제령아랫말길 67-26", 0
6041, "제주 구엄543 (바다앞독채펜션)", "제주 제주시 애월읍 애월해안로 742 애월읍 애월해안로 742", 0
6949, "강원고성해변하우스", "강원 고성군 토성면 천진해변길 29", 0
6047, "해남 월드펜션", "전남 해남군 삼산면 대흥사길 154-8 삼산면 대흥사길 154-8", 0
5378, "전주 행복한추억 게스트하우스", "전북 전주시 완산구 문화광장로 25 완산구 문화광장로 25", 0
13252, "미스테이 동성로 스타비앤비점", "대구 중구 국채보상로 562", 0
7857, "순천 단꿈 스테이", "전남 순천시 역전길 63", 0
6716, "제주 라임오렌지빌", "제주 서귀포시 칠십리로 332 칠십리로 332", 0
7750, "구리 우남퍼스트빌 365스테이", "경기 구리시 안골로 65", 0
5049, "백암산장펜션/애견동반", "전북 무주군 설천면 구천동1로 129-22 설천면 구천동1로 129-22", 0
6069, "제주수망펜션", "제주 서귀포시 남원읍 서성로 986-24 남원읍 서성로 986-24", 0
13337, "가평 썬풀빌라/22년 리뉴얼", "경기 가평군 상면 수목원로 92-45", 0
5028, "보령 로마 펜션", "충남 보령시 해수욕장13길 14-12 해수욕장13길 14-12", 0
5624, "서귀포 투데이 펜션", "제주 서귀포시 예래로 267-2 예래로 267-2", 0
6637, "성산 레몬밤스테이(2박이상예약가능)", "제주 서귀포시 성산읍 난고로34번길 61 성산읍 난고로34번길 61", 0
13834, "속초 월드스카이", "강원 속초시 청초호반로 267", 0
6097, "[원주]문막오크카운티펜션", "강원 원주시 지정면 구재로 352-4 지정면 구재로 352", 0
7281, "그리다 강릉", "강원 강릉시 옥천로62번길 20", 0
7020, "퇴촌 뜰에산에펜션", "경기 광주시 퇴촌면 천진암로 994-13", 0
5264, "제주 쁘띠빅터 펜션", "제주 제주시 서해안로 338 서해안로 340", 0
6214, "충청보령삽시도솔향기", "충남 보령시 오천면 삽시도3길 65-9 오천면 삽시도3길 65-9", 0
10764, "진아리랑호스텔", "전남 여수시 돌산읍 강남2길 6-18", 0
8870, "온더스톤게스트하우스 2호점", "제주 서귀포시 성산읍 성산등용로 100-4", 0
8904, "소풍펜션", "전북 무주군 설천면 내배방길 9-1", 0
7356, "아쿠아마린글램핑", "경기 포천시 이동면 성장로1289번길 204", 0
8799, "대천 피터팬펜션", "충남 보령시 해수욕장13길 10-16", 0
11142, "하나원리조트", "전북 완주군 운주면 금고당로 902", 0
9033, "아름다운바다", "강원 양양군 강현면 동해대로 3573", 0
6749, "전라부안위도아일랜드", "전북 부안군 위도면 벌금항길 10", 0
5261, "강릉 상상스파 펜션 18년 신축", "강원 강릉시 사천면 진리해변길 131 사천면 진리해변길 131", 0
6078, "홍천 썬호텔펜션", "강원 홍천군 서면 한서로 2141-7 서면 한서로 2141-7", 0
10848, "무주리조텔", "", 0
9332, "무코바란 게스트하우스", "강원 동해시 일출로 10", 0
12716, "방포비치펜션", "충남 태안군 안면읍 방포1길 24", 0
10001, "양양 골든베이펜션", "강원 양양군 현북면 하조대2길 48-9", 0
6758, "양양 알프스비치", "강원 양양군 현북면 하조대해안길 11", 0
8987, "성산에오거들랑게스트하우스", "제주 서귀포시 성산읍 고성동서로 13-7", 0
5339, "양양 골든베이펜션", "강원 양양군 현북면 하조대2길 48-9 현북면 하조대2길 48-9", 0
10459, "합천 준호텔", "경남 합천군 대양면 동부로 64-88", 0
7272, "강촌 파인힐펜션", "강원 춘천시 남산면 강촌구곡길 11-1", 0
7442, "양양캠핑장", "강원 양양군 현북면 어성전길 182-18", 0
7275, "경주 장 펜션", "경북 경주시 태종로 801", 0
8922, "꿈에그린하우스펜션", "인천 옹진군 영흥면 영흥북로35번길 5", 0
8325, "게스트하우스 빅썸", "제주 서귀포시 남원읍 태위로 984-7", 0
9257, "은하수펜션", "충남 논산시 연무읍 진등길 27", 0
11373, "지리산리틀프린스펜션", "전남 구례군 마산면 화엄사로 386-9", 0
10133, "태안몽산포 마리솔펜션&리조트", "충남 태안군 남면 몽산포길 85", 0
12838, "하비캠프펜션", "충남 태안군 남면 진산1길 277-126", 0
13637, "지중해아침펜션", "충남 태안군 고남면 큰장돌길 141-98", 0
10303, "무주 마리나풀빌라&스파펜션", "전북특별자치도 무주군 무풍면 삼거리 340-5 무풍면 구천동로 519", 0
11170, "제니홈 전주게스트하우스", "전북 전주시 덕진구 장재안길 6", 0
5002, "대천 골든로즈 펜션", "충남 보령시 고잠2길 16-5 고잠2길 16-5", 0
12455, "산바다펜션", "전북 부안군 변산면 궁항영상길 36", 0
8442, "스노우밸리펜션", "전북 무주군 설천면 만선로 36-37", 0
7453, "오크밸리카라반", "강원 원주시 지정면 오크밸리2길 38", 0
11701, "춘천 산에들에펜션", "강원 춘천시 남산면 소주고개로 465-12", 0
7427, "파인트리글램핑", "충남 서천군 서면 갯벌체험로 295-12", 0
8642, "펜스토리펜션", "강원 평창군 봉평면 두리봉길 30", 0
6757, "대천 스위스샬레 스파펜션", "충남 보령시 머드로 3", 0
6210, "가평 모리마을 펜션", "경기 가평군 북면 싸리재길 171 북면 싸리재길 171", 0
12306, "다솔강풀빌라", "경북 경주시 도초길 158-15", 0
8376, "리틀프로방스펜션", "전북 무주군 설천면 구천동로 930-18", 0
12196, "이큐스테이", "제주 제주시 한림읍 금능남1길 6-1", 0
5570, "정다운펜션", "충남 예산군 덕산면 온천단지1로 105 덕산면 온천단지1로 105", 0
10412, "퍼스트펜션", "충남 태안군 근흥면 연포2길 78", 0
7499, "포천 운악산글램핑", "경기 포천시 화현면 화동로432번길 92-131", 0
14694, "가평 하루강아지 애견펜션", "경기 가평군 상면 수목원로386번길 12-17", 0
9042, "꿈꾸는 시계 펜션", "충남 논산시 벌곡면 수락로443번길 49", 0
8923, "만리포왈츠하임펜션", "충남 태안군 소원면 만리포1길 129", 0
11429, "몽산142", "충남 태안군 남면 몽산포길 142", 0
9542, "별이보이는펜션", "충남 태안군 안면읍 송림길 3-2", 0
12144, "뷰티플하우스", "제주 서귀포시 이어도로253번길 2", 0
7307, "속초 시그니처펜션", "강원 속초시 영랑해안8길 11", 0
8654, "안동풍경호스텔N라이브러리", "경북 안동시 노하2길 19-5", 0
7172, "속초 써밋베이 시그니처", "강원 속초시 영랑해안8길 11", 0
11343, "욜로호텔엔펜션", "강원 강릉시 주문진읍 항구윗길 13", 0
10954, "정동진 호텔탑스빌", "강원 강릉시 강동면 헌화로 1007-34", 0
9842, "여수 씨스타호스텔", "전남 여수시 소호1길 40", 0
10805, "그랜드펜션", "전북 무주군 설천면 구천동1로 135-6", 0
10535, "다숲펜션", "전북 무주군 설천면 구천동1로 149", 0
10586, "대천 체리펜션", "충남 보령시 해수욕장9길 2-19", 0
5745, "평창 마이아 펜션", "강원 평창군 봉평면 석이바우길 71-20", 0
13702, "메모리아리조트", "제주 서귀포시 성산읍 일주동로 5199-3", 0
11978, "무주 아이리스펜션", "전북 무주군 설천면 구천동로 930-10", 0
13175, "아브리코풀빌라 앤 리조트", "전남 여수시 돌산읍 안굴전길 24", 0
10285, "선녀펜션", "강원 속초시 해오름로 73", 0
10358, "스텔라펜션", "경북 경주시 북군길 107-21", 0
11013, "신진펜션", "충남 보령시 대해로 882", 0
11243, "연포펜션하우스", "충남 태안군 근흥면 용도로 99", 0
8449, "라모스리조트", "충남 태안군 태안읍 안도내길 28-14", 0
6131, "삼척 하늘 펜션", "강원 삼척시 근덕면 장호길 44", 0
11501, "오션패밀리호텔", "제주 제주시 일주서로 7531", 0
8708, "해뜨는집펜션", "강원 홍천군 영귀미면 덕치길 1", 0
10951, "변산 지펜션", "전북 부안군 변산면 격포로 142", 0
10562, "삼척 더끌림펜션", "강원 삼척시 근덕면 용화길 27-62", 0
12175, "설악온천맘모스리조텔", "강원 속초시 청봉로5길 22", 0
12698, "신영펜션", "강원 홍천군 서면 한치골길 75-12", 0
8321, "전주한옥마을 너울가지", "전북 전주시 완산구 풍남문4길 16-9", 0
5975, "아쇼카펜션", "강원 양양군 손양면 선사유적로 316-104 손양면 선사유적로 316-104", 0
8301, "아쇼카펜션", "강원 양양군 손양면 선사유적로 316-84", 0
11021, "아트인하우스", "인천 옹진군 영흥면 영흥남로452번길 52", 0
10203, "1박2일펜션", "강원 고성군 토성면 토성로 53", 0
9725, "우리벨리펜션", "경기 양평군 단월면 상가마길1번길 20", 0
6215, "제주도 라임오렌지빌리지", "제주 서귀포시 칠십리로 332 칠십리로 332", 0
10811, "안면도 힐링하우스펜션", "충남 태안군 안면읍 꽃지2길 49-20", 0
10856, "1974하우스", "경북 경주시 동성로 34", 0
11589, "간장남들게스트하우스파티", "제주 서귀포시 안덕면 사계북로41번길 30", 0
10332, "남해송정황토펜션", "경남 남해군 미조면 남해대로 272-15", 0
9151, "캡슐마중게스트하우스", "서울 영등포구 경인로100길 1-10", 0
9643, "실로암펜션", "전남 장성군 서삼면 추암로 504", 0
9755, "훼미리하우스펜션", "전북 무주군 설천면 관동길 15", 0
8221, "대부도 블루라떼 펜션", "인천 옹진군 영흥면 선재로317번길 48", 0
8795, "대천라라펜션", "충남 보령시 고잠2길 4-17", 0
10741, "라차비치", "충남 태안군 남면 몽대로 494-8", 0
8451, "대천힐링펜션", "충남 보령시 고잠2길 22", 0
9302, "별둘펜션", "충남 보령시 고잠2길 20-2", 0
4941, "보령 힐링 펜션", "충남 보령시 고잠2길 22 고잠2길 22", 0
10192, "블루라군펜션", "충남 태안군 이원면 원이로 2771-226", 0
13960, "빌리지피어", "전남 여수시 돌산읍 계동로 393-1", 0
4967, "삼척 더끌림펜션", "강원 삼척시 근덕면 용화길 27-62 근덕면 용화길 27-62", 0
9887, "어울림펜션", "강원 강릉시 연곡면 해안로 1377", 0
9710, "울산 배내골 파라다이스펜션", "울산 울주군 상북면 배내로 1187", 0
14738, "이스턴모스트카라반캠핑", "경북 포항시 남구 구룡포읍 땅끝마을길 47", 0
10779, "참새골 황토펜션", "전남 무안군 해제면 참새골길 58-19", 0
10979, "체리스펜션", "전북 무주군 설천면 보안길 50-32", 0
4899, "태안 샤론 펜션(6주년감사이벤트)", "충남 태안군 남면 청포대길 102 남면 청포대길 102", 0
10936, "파티파티펜션", "충남 태안군 남면 청포대길 84", 0
9690, "필관광하우스펜션", "전남 광양시 옥룡면 묵방길 10", 0
13102, "땅끝고구마글램핑", "전남 해남군 화산면 평호길 288-12", 0
12494, "동명스테이", "강원 속초시 영금정로 18", 0
7451, "무주글램핑&풀빌라카라반", "전북 무주군 설천면 구천동1로 138", 0
12035, "한우리펜션민박", "강원 고성군 죽왕면 삼포민박촌1길 2-1", 0
10912, "화순 아델캐슬풀빌라", "전남 화순군 도곡면 지강로 459-7", 0
5132, "거제비치하우스애견펜션", "경남 거제시 장목면 옥포대첩로 1358 장목면 옥포대첩로 1358", 0
9296, "참좋은펜션", "경남 밀양시 단장면 표충로 1064-60", 0
9066, "43번가게스트하우스", "강원 평창군 대관령면 오목길 43-58", 0
11462, "AND메타 978펜션", "전남 장성군 북하면 담장로 1258-8", 0
13999, "가평 벨르앙쥬 애견 독채 펜션", "경기 가평군 상면 임초밤안골로 269-16", 0
8001, "가평 벨리타 스파 펜션", "경기 가평군 청평면 상지로 349", 0
10078, "강촌 아띠펜션", "강원 춘천시 남산면 강촌로 174-8", 0
13640, "강촌해피데이", "강원 춘천시 남산면 갯골길 62-4", 0
7148, "괴산 곰돌이워터 펜션", "충북 괴산군 청천면 화양로 753", 0
6093, "해산관광농원펜션", "강원 화천군 화천읍 호음로 474 화천읍 호음로 474", 0
11157, "대천뜨란채펜션", "충남 보령시 고잠2길 16-16", 0
8847, "대천하이펜션", "충남 보령시 고잠2길 24", 0
9503, "레인보우캐슬펜션", "충남 태안군 남면 몽대로 333-11", 0
8739, "메이플밸리", "전남 구례군 토지면 당치길 6", 0
10162, "모나코펜션", "충남 보령시 고잠2길 14", 0
14829, "무주 오페라펜션&키즈풀빌라", "전북 무주군 설천면 보안길 16-7", 0
10878, "노라부러펜션", "충남 태안군 안면읍 방포로 54-39", 0
11434, "해조대펜션", "제주 제주시 한림읍 한림로 339", 0
4942, "보령 하이 펜션", "충남 보령시 고잠2길 24 고잠2길 24", 0
9923, "송라해송펜션", "경북 포항시 북구 송라면 봉화길 207", 0
7534, "양평 와이글램핑", "경기 양평군 용문면 강이대길38번길 26-37", 0
13077, "어느날스파펜션", "경기 가평군 청평면 상지로 263", 0
5097, "에코피아펜션", "경기 가평군 북면 가화로 3010 북면 가화로 3010", 0
6855, "여수 뮤지컬하우스", "전남 여수시 율촌면 두언길 106-31", 0
7695, "여수펜션 모아모아 오션뷰&스파펜션", "전남 여수시 화양면 화서로 146-1", 0
11732, "연인산밸리", "경기 가평군 북면 백둔로 61-58", 0
7134, "영양펜션 산적", "경북 영양군 입암면 주역1길 10-24", 0
14525, "오션클럽 스파&풀빌라", "경남 남해군 이동면 남서대로 397-22", 0
13094, "일마레펜션", "강원 동해시 대진항길 23", 0
13243, "춘천 남이섬 애견 가족 전원마을 펜션", "강원 춘천시 남산면 서백길 458", 0
14225, "칠불암한옥펜션", "경북 경주시 칠불암길 83", 0
5959, "태안 바다풍경펜션", "충남 태안군 소원면 만리포2길 235-30 소원면 만리포2길 235-30", 0
14412, "포항펜션 피유 키즈풀빌라", "경북 포항시 남구 장기면 동해안로 3717", 0
11485, "한가라지리조트", "인천 강화군 삼산면 삼산남로 1011", 0
10838, "무주산책펜션", "전북 무주군 설천면 구천동1로 132", 0
6625, "가평 산타마리아 펜션", "경기 가평군 가평읍 복장포길 118-3", 0
9273, "삼척피렌체펜션", "강원 삼척시 근덕면 삼척로 2245", 0
7725, "설인펜션", "전북 무주군 설천면 삼공2길 4", 0
7717, "가평 아이엠101", "경기 가평군 북면 백둔로133번길 40", 0
11119, "강촌 숲속의강촌펜션", "강원 춘천시 남산면 강촌로 186-3", 0
9155, "개미촌펜션", "충남 보령시 해수욕장13길 13", 0
6076, "거제 가온아라스파 펜션", "경남 거제시 남부면 남부해안로 27", 0
8667, "그람피하우스", "충남 태안군 남면 안면대로 1110-30", 0
9401, "남해아리아펜션", "경남 남해군 삼동면 동부대로1122번길 132-32", 0
8738, "노블펜션", "전북 부안군 변산면 궁항로 54", 0
8599, "대천 로마펜션", "충남 보령시 해수욕장13길 14-12", 0
4843, "대천 올레펜션", "충남 보령시 고잠2길 16-11 고잠2길 16-11", 0
10685, "대천 큰하늘펜션", "충남 보령시 고잠2길 4-9", 0
9524, "대천해수욕장준펜션", "충남 보령시 해수욕장13길 11", 0
10959, "레어모스풀빌라", "충북 보은군 산외면 내북산외로 346-61", 0
7359, "맘빌리지카라반", "충남 태안군 소원면 법산길 350-60", 0
10173, "메모리펜션", "충남 보령시 고잠2길 12-18", 0
10630, "보령 올레펜션", "충남 보령시 고잠2길 16-11", 0
10791, "봄여름가을겨울펜션", "강원 평창군 봉평면 거품소길 269", 0
10956, "부안 아르코스파펜션", "전북 부안군 변산면 변산해변로 799-55", 0
10261, "비치스토리펜션", "충남 보령시 고잠2길 8-26", 0
12595, "가평 아이엠101", "경기 가평군 북면 백둔로133번길 40", 0
5220, "가평 청풍명월 펜션", "경기 가평군 설악면 유명로 2429 설악면 유명로 2429", 0
11786, "빅토리아펜션", "충남 태안군 고남면 큰장돌길 283-42", 0
5674, "삼척 장호 굿모닝펜션", "강원 삼척시 근덕면 장호1길 7 근덕면 장호1길 7", 0
6934, "속초 설악의풍경", "강원 속초시 바람꽃마을길 132-8", 0
10853, "송소고택", "경북 청송군 파천면 송소고택길 15-2", 0
11585, "썬블루펜션", "충남 태안군 근흥면 용도로 480", 0
10124, "아라솜펜션", "경남 통영시 산양읍 풍화일주로 1195", 0
10156, "안동 펜션앤게스트", "경북 안동시 풍산읍 풍산태사로 2119", 0
10722, "안면도 그때그펜션", "충남 태안군 안면읍 안면대로 2608-193", 0
5012, "안면도 빈티지하우스 펜션", "충남 태안군 안면읍 꽃지해안로 172-3 안면읍 꽃지해안로 172-3", 0
12574, "안면도웰빙", "충남 태안군 남면 안면대로 1711-39", 0
